{
  "schema_version": 1,
  "result_kind": "measured",
  "contains_sensitive_data": false,
  "benchmark_id": "local-helper-sparse-workspace-cold",
  "recorded_at": "2026-07-30T17:59:49Z",
  "provenance": {
    "yeokcham_version": "4d31ebe",
    "yeokcham_commit": "4d31ebeca865660ae984e7a3e948da9a297361aa",
    "worktree_dirty": false,
    "git_version": "git version 2.55.0",
    "rust_version": "rustc 1.85.0 (4d91de4e4 2025-02-17)",
    "harness_version": "1"
  },
  "environment": {
    "os_name": "Darwin",
    "os_version": "26.5.2",
    "kernel_version": "25.5.0",
    "architecture": "arm64",
    "cpu_model": "Apple M3",
    "logical_cpu_count": 8,
    "memory_bytes": 17179869184,
    "storage_device": "/dev/disk3s5",
    "filesystem": "/",
    "available_disk_bytes": 62513958912
  },
  "fixture": {
    "id": "generated-sparse-workspace",
    "version": "1",
    "workload": "w5_monorepo_sparse_workspace",
    "checksum_algorithm": "sha256",
    "checksum": "058e71b5460aaa5c10d62371c6850f56fddd6cf8605f4a71636921c590259080",
    "parameters": {"revisions": 2, "selected_paths": 1, "excluded_current_bytes": 4194304, "excluded_historical_bytes": 4194304}
  },
  "configuration": {
    "cache_state": "cold",
    "backend_kind": "local_remote_helper",
    "parameters": {"filter": "blob:none", "sparse_mode": "cone", "sparse_paths": ["app"], "cache_layer": "snapshot-pack", "transport_metric": "client .pack payload bytes"}
  },
  "network_conditions": {
    "mode": "local",
    "description": "local git-remote-yeokcham process transport; received pack payload bytes are recorded below",
    "round_trip_latency_ms": 0,
    "packet_loss_percent": 0,
    "bandwidth_limit_bytes_per_second": null
  },
  "run": {
    "started_at": "2026-07-30T17:59:45Z",
    "ended_at": "2026-07-30T17:59:49Z",
    "repetitions": 5,
    "warmup_repetitions": 1,
    "command": ["git", "clone --no-checkout --filter=blob:none yeokcham::<store> <target>", "git sparse-checkout set --cone app", "git checkout main"]
  },
  "metrics": {
    "median_wall_time_ns": 830000000,
    "p95_wall_time_ns": 830000000,
    "p99_wall_time_ns": 830000000,
    "median_cpu_time_ns": 640000000,
    "peak_rss_bytes": 36569088,
    "io_bytes_read": null,
    "io_bytes_written": null,
    "network_request_count": 2,
    "network_bytes_sent": 0,
    "network_bytes_received": 772,
    "final_storage_bytes": 151552
  }
}
