{
  "schema_version": 1,
  "result_kind": "measured",
  "contains_sensitive_data": false,
  "benchmark_id": "local-import-parallel-object-read-parallel",
  "recorded_at": "2026-07-31T05:39:03Z",
  "provenance": {
    "yeokcham_version": "ed7613b-dirty",
    "yeokcham_commit": "ed7613b734f43095139095facedfb3371bbbcd2a",
    "worktree_dirty": true,
    "git_version": "git version 2.55.0",
    "rust_version": "rustc 1.85.0 (4d91de4e4 2025-02-17)",
    "harness_version": "1"
  },
  "environment": {
    "os_name": "Darwin",
    "os_version": "26.5.2",
    "kernel_version": "25.5.0",
    "architecture": "arm64",
    "cpu_model": "Apple M3",
    "logical_cpu_count": 8,
    "memory_bytes": 17179869184,
    "storage_device": "/dev/disk3s5",
    "filesystem": "/",
    "available_disk_bytes": 59362566144
  },
  "fixture": {
    "id": "parallel-import-large-object-v1",
    "version": "1",
    "workload": "w3_large_changing_binary",
    "checksum_algorithm": "sha256",
    "checksum": "c7fd95750ada533132abd6e43c111bb106f22ee64ff2a3aec4e7635e6866ace0",
    "parameters": {"object_count": 8, "object_bytes": 4194304, "history_revisions": 1}
  },
  "configuration": {
    "cache_state": "cold",
    "backend_kind": "local_filesystem",
    "parameters": {"object_read_workers": 2, "chunked_blob_minimum_bytes": 67108864}
  },
  "network_conditions": {
    "mode": "local",
    "description": "local filesystem only",
    "round_trip_latency_ms": 0,
    "packet_loss_percent": 0,
    "bandwidth_limit_bytes_per_second": null
  },
  "run": {
    "started_at": "2026-07-31T05:39:03Z",
    "ended_at": "2026-07-31T05:39:03Z",
    "repetitions": 5,
    "warmup_repetitions": 1,
    "command": ["yeokcham", "init", "--from-git", "parallel-import-large-object-v1", "--chunked-blob-minimum", "67108864", "--object-read-workers", "2"]
  },
  "metrics": {
    "median_wall_time_ns": 1910000000,
    "p95_wall_time_ns": 2310000000,
    "p99_wall_time_ns": 2310000000,
    "median_cpu_time_ns": 1390000000,
    "peak_rss_bytes": 48709632,
    "io_bytes_read": null,
    "io_bytes_written": null,
    "network_request_count": 0,
    "network_bytes_sent": 0,
    "network_bytes_received": 0,
    "final_storage_bytes": 33693696
  }
}
