{"schema_version":1,"result_kind":"measured","contains_sensitive_data":false,"benchmark_id":"local-daemon-startup","recorded_at":"2026-07-31T03:16:32Z","provenance":{"yeokcham_version":"8439053-dirty","yeokcham_commit":"8439053283d838bf43946a9bf97ee22e03d82b95","worktree_dirty":true,"git_version":"git version 2.55.0","rust_version":"rustc 1.85.0 (4d91de4e4 2025-02-17)","harness_version":"1"},"environment":{"os_name":"Darwin","os_version":"26.5.2","kernel_version":"25.5.0","architecture":"arm64","cpu_model":"Apple M3","logical_cpu_count":8,"memory_bytes":17179869184,"storage_device":"/dev/disk3s5","filesystem":"/","available_disk_bytes":61894066176},"fixture":{"id":"daemon-protocol-v1","version":"1","workload":"custom","checksum_algorithm":"sha256","checksum":"4543841e6acbc1a7f1ff868aec2be17d5915a324ef8f894aecccb45d5a2cc8a6","parameters":{"messages":2,"socket_transport":"unix"}},"configuration":{"cache_state":"not_applicable","backend_kind":"local_daemon","parameters":{"socket":"private temporary Unix socket","protocol":"YKDP-v1"}},"network_conditions":{"mode":"local","description":"private AF_UNIX socket; no network listener","round_trip_latency_ms":0,"packet_loss_percent":0,"bandwidth_limit_bytes_per_second":null},"run":{"started_at":"2026-07-31T03:16:31Z","ended_at":"2026-07-31T03:16:32Z","repetitions":5,"warmup_repetitions":0,"command":["yeokcham-daemon --socket <private-temp-socket>","YKDP ping","YKDP shutdown"]},"metrics":{"median_wall_time_ns":70000000,"p95_wall_time_ns":640000000,"p99_wall_time_ns":640000000,"median_cpu_time_ns":0,"peak_rss_bytes":5931008,"io_bytes_read":null,"io_bytes_written":null,"network_request_count":0,"network_bytes_sent":0,"network_bytes_received":0,"final_storage_bytes":0}}
